{
  "schema": 1,
  "board": 1,
  "name": "Komplete Kontrol M32",
  "keys": { "count": 32, "lowest_note": 41, "velocity": true, "aftertouch": false, "light_guide": false },
  "knobs": { "count": 8, "steps_per_turn": 110, "touch": true, "layout": "row" },
  "encoder": { "turn": true, "push": true, "directions": 4, "touch": false },
  "strips": [
    { "id": "pitch", "touch": true, "touch_note": 72, "output": "pitch-bend" },
    { "id": "mod", "touch": true, "touch_note": 73, "output": "cc" }
  ],
  "pedals": { "jacks": 1, "contacts": ["tip", "ring"] },
  "screen": { "kind": "mono", "width": 128, "height": 32, "text_rows": 4, "list_rows": 3 },
  "lights": { "kind": "levels", "states": ["off", "dim", "on", "blink"] },
  "controls": [
    { "id": 0,  "name": "shift",       "label": "SHIFT",    "kind": "button", "light": true },
    { "id": 1,  "name": "scale",       "label": "SCALE",    "kind": "button", "light": true, "keyboard_owned": true },
    { "id": 2,  "name": "arp",         "label": "ARP",      "kind": "button", "light": true, "keyboard_owned": true },
    { "id": 3,  "name": "undo",        "label": "UNDO",     "kind": "button", "light": true },
    { "id": 4,  "name": "quantize",    "label": "QUANTIZE", "kind": "button", "light": true },
    { "id": 5,  "name": "ideas",       "label": "IDEAS",    "kind": "button", "light": true },
    { "id": 6,  "name": "loop",        "label": "LOOP",     "kind": "button", "light": true },
    { "id": 7,  "name": "metro",       "label": "METRO",    "kind": "button", "light": true },
    { "id": 8,  "name": "tempo",       "label": "TEMPO",    "kind": "button", "light": true },
    { "id": 9,  "name": "play",        "label": "PLAY",     "kind": "button", "light": true },
    { "id": 10, "name": "rec",         "label": "REC",      "kind": "button", "light": true },
    { "id": 11, "name": "stop",        "label": "STOP",     "kind": "button", "light": true },
    { "id": 12, "name": "preset_up",   "label": "PRESET ▲", "kind": "button", "light": true },
    { "id": 13, "name": "preset_down", "label": "PRESET ▼", "kind": "button", "light": true },
    { "id": 14, "name": "mute",        "label": "M",        "kind": "button", "light": true, "keyboard_owned": "without shift" },
    { "id": 15, "name": "solo",        "label": "S",        "kind": "button", "light": true, "keyboard_owned": "without shift" },
    { "id": 16, "name": "browser",     "label": "BROWSER",  "kind": "button", "light": true, "keyboard_owned": "with shift" },
    { "id": 17, "name": "plugin",      "label": "PLUG-IN",  "kind": "button", "light": true, "keyboard_owned": true },
    { "id": 18, "name": "track",       "label": "TRACK",    "kind": "button", "light": true, "keyboard_owned": true },
    { "id": 19, "name": "octave_down", "label": "OCTAVE −", "kind": "button", "light": true, "keyboard_owned": true },
    { "id": 20, "name": "octave_up",   "label": "OCTAVE +", "kind": "button", "light": true, "keyboard_owned": true },
    { "id": 21, "name": "nav_up",      "label": "4D ▲",     "kind": "encoder_direction" },
    { "id": 22, "name": "nav_left",    "label": "4D ◀",     "kind": "encoder_direction" },
    { "id": 23, "name": "nav_right",   "label": "4D ▶",     "kind": "encoder_direction" },
    { "id": 24, "name": "nav_down",    "label": "4D ▼",     "kind": "encoder_direction" },
    { "id": 25, "name": "nav_push",    "label": "4D push",  "kind": "encoder_push" },
    { "id": 26, "name": "pedal_plug",  "label": "PEDAL",    "kind": "state" }
  ]
}
